{
  "schema_id": "dd-flow/project-flow-pack-manifest@2",
  "pack_version": "2026-06-12.1",
  "flow_origin_policy": "project_local_pack",
  "canon_root": "/Users/example/dd-memorybank",
  "canon_memory_bank_root": "/Users/example/dd-memorybank/.memory-bank",
  "canon_flow_root": "/Users/example/dd-memorybank/.memory-bank/dd-flow",
  "source_commit": "abc1234",
  "canon_version_at_source_commit": "2.3.0",
  "flow_contract": "dd-flow-canonical-2026-05",
  "installed_at": "2026-06-12T10:00:00Z",
  "included_files": [
    "go.md",
    "f.md",
    "prime.md",
    "plan.md",
    "code.md",
    "merge.md",
    "merge-start.md",
    "merge-stop.md",
    "mb-audit.md",
    "mb-fix.md",
    "mb-lint.md",
    "common/style.md",
    "common/changelog.md",
    "common/flow-origin.md",
    "common/runtime-cli.md",
    "common/worker-session.md",
    "workers/docs.md",
    "workers/repair.md",
    "workers/knowledge-extraction.md",
    "workers/knowledge-promotion.md",
    "workers/protocol-archive.md",
    "prime/scouts/index.md",
    "prime/scouts/memory-bank.md",
    "prime/scouts/code-surface.md",
    "prime/scouts/patterns.md",
    "prime/scouts/verification.md",
    "prime/scouts/operations.md",
    "prime/scouts/risk.md",
    "plan/stage-report-template.html",
    "code/stage-report-template.html",
    "merge/job.md",
    "merge/integrate.md",
    "merge/stage-report-template.html",
    "schemas/flow-run-index.schema.json",
    "schemas/knowledge-candidates.schema.json",
    "schemas/knowledge-promotion-report.schema.json"
  ],
  "excluded_canonical_only_flows": [
    "mb-init.md",
    "mb-upgrade.md",
    "mb-distill.md"
  ],
  "generated_allow_patterns": [
    ".generated/**"
  ],
  "notes": "Minimal example; real packs include all required support files."
}
